Course Name,Course Link,Coupon,Expiration
Aprende Inversion inmobiliaria online y de plazos fijos.,https://www.udemy.com/course/inversiones-online-para-principiantes-2023/,0B45A6D1C4B3E480003F,2023-03-09
Aprende a ganar dinero extra online con surebets 2022,https://www.udemy.com/course/aprende-a-ganar-dinero-extra-online-con-surebets-2022/,5D123124720EB630487,2023-03-09
Administration of Red Hat Linux Practice Test 1: Essentials,https://www.udemy.com/course/administration-of-red-hat-linux-practice-test-1-essentials/,97F06C8776AADA011CEC,2023-03-09
Administration of Red Hat Linux Practice Test 2: Environment,https://www.udemy.com/course/administration-of-red-hat-linux-practice-test-2-environment/,7FE10B65629CEB749617,2023-03-09
DevOps Tools for Beginners: Git in 1 hour,https://www.udemy.com/course/devops-tools-for-beginners-git-in-1-hour/,65B0E757872E845BA600,2023-03-09
DevOps Tools for Beginners: Linux Command Line in 1 hour,https://www.udemy.com/course/devops-tools-for-beginners-linux-command-line-in-1-hour/,B285BC6922F4BD4B5A45,2023-03-09
The Complete 2023 Swift & SwiftUI (IOS App Course) [Arabic],https://www.udemy.com/course/swift-swiftui-ios/,5C5A9AC9D9120A2A8421,2023-03-09
Udemy Business of Teaching: Marketing & Promotion Unofficial,https://www.udemy.com/course/coursemarketing/,090A4BC5893857D0235D,2023-03-09
Python for beginners - Learn all the basics of python,https://www.udemy.com/course/python-for-beginners-learn-all-the-basics-of-python/,ED23CD74F55090665CA9,2023-03-09
Python for beginners - Learn all the basics of python,https://www.udemy.com/course/python-for-beginners-learn-all-the-basics-of-python/,ED23CD74F55090665CA9,2023-03-09
